{"schema":2,"at":"2026-08-26T12:00:00Z","host":{"cpu_pct":12.5,"ncpu":16,"mem_total":1024,"mem_avail":512,"uptime_s":99.5},"rows":[{"pid":42,"comm":"grok","name":"grok","role":"primary","runtime":"grok","status":"idle","rss":2048,"overlay_ok":false},{"pid":7,"comm":"claude","name":"Heph","project":"aitop","model":"opus","role":"primary","runtime":"claude","status":"idle","rss":1,"tokens":0,"ctx_window":0,"ctx_fill":0,"cost_usd":0,"cost_source":"table:builtin","usage":{"input":0,"cache_read":0,"cache_write":0,"output":0},"slot_index":0,"overlay_ok":true}],"graph":{"at":"2026-08-26T12:00:00.000000001Z","topology_revision":4,"visibility_revision":3,"state_revision":2,"metrics_revision":1,"nodes":[{"id":"claude:session:alpha","incarnation":"claude:invocation:alpha","runtime":"claude","role":"primary","proven_name":"Heph","model":"opus","project":"aitop","process":{"pid":42,"start_ticks":100},"state":{"value":"active","source":{"id":"aitop:store:normal","runtime":"claude","incarnation":"0000000000000001","authority":"native"},"since":"2026-08-26T11:30:00Z","valid_until":"2026-08-26T12:15:00Z","stale":false},"metrics":{"usage":{"input":0,"cache_read":0,"cache_write":0,"output":0},"token_rate":0,"context_used":0,"context_window":0,"context_fill":0,"cache_use":0,"cost_usd":0,"cost_source":"table:builtin"},"started_at":"2026-08-26T11:00:00Z","pinned":false,"telemetry_at":"2026-08-26T12:00:00.000000001Z","partial":false,"transitions":[{"at":"2026-08-26T11:30:00Z","state":"active","source":{"id":"aitop:store:normal","runtime":"claude","incarnation":"0000000000000001","authority":"native"}}]},{"id":"claude:session:beta","incarnation":"claude:invocation:beta","runtime":"claude","role":"subagent","state":{"value":"completed","source":{"id":"aitop:store:normal","runtime":"claude","incarnation":"0000000000000001","authority":"native"},"since":"2026-08-26T11:45:00Z","stale":false},"metrics":{},"started_at":"2026-08-26T11:00:00Z","completed_at":"2026-08-26T11:45:00Z","ghost_expires_at":"2026-08-26T12:30:00Z","pinned":false,"telemetry_at":"2026-08-26T12:00:00.000000001Z","partial":true,"transitions":[]},{"id":"grok:session:gamma","incarnation":"grok:invocation:gamma","runtime":"grok","role":"sidecar","state":{"value":"failed","source":{"id":"aitop:store:state","runtime":"grok","incarnation":"0000000000000002","authority":"hook"},"since":"2026-08-26T11:50:00Z","stale":true},"metrics":{},"started_at":"2026-08-26T11:00:00Z","failed_at":"2026-08-26T11:50:00Z","ghost_expires_at":"2026-08-26T12:30:00Z","pinned":true,"telemetry_at":"2026-08-26T12:00:00.000000001Z","partial":false,"transitions":[]},{"id":"local:unit:delta","incarnation":"local:invocation:delta","runtime":"local","role":"monitor","state":{"value":"vanished","source":{"id":"aitop:receiver","runtime":"local","incarnation":"0000000000000003","authority":"passive"},"since":"2026-08-26T11:40:00Z","stale":false},"metrics":{},"started_at":"2026-08-26T11:00:00Z","ghost_expires_at":"2026-08-26T12:30:00Z","pinned":false,"telemetry_at":"2026-08-26T12:00:00.000000001Z","partial":false,"transitions":[]}],"edges":[{"key":"launch-key","source":"claude:session:alpha","target":"local:unit:delta","type":"launch","provenance":"trace-handshake","relationship":"__8","trace":"CgoKCgoKCgoKCgoKCgoKCg","created_at":"2026-08-26T11:10:00Z","last_activity":"2026-08-26T11:55:00Z","event_count":1,"lifecycle":"active","partial":false},{"key":"message-key","source":"claude:session:beta","target":"claude:session:alpha","type":"message","provenance":"native","created_at":"2026-08-26T11:10:00Z","last_activity":"2026-08-26T11:55:00Z","event_count":3,"lifecycle":"active","message_kind":"direct","delivery":{"unknown":0,"emitted":1,"received":2,"failed":0,"latest":"received"},"partial":false},{"key":"service-key","source":"claude:session:alpha","target":"grok:session:gamma","type":"service","provenance":"aitop-sidecar","relationship":"_w","created_at":"2026-08-26T11:10:00Z","last_activity":"2026-08-26T11:55:00Z","event_count":2,"lifecycle":"ghost","partial":true},{"key":"spawn-key","source":"claude:session:alpha","target":"claude:session:beta","type":"spawn","provenance":"native","relationship":"AQID","created_at":"2026-08-26T11:10:00Z","last_activity":"2026-08-26T11:55:00Z","event_count":1,"lifecycle":"active","partial":false}],"gaps":[{"source":"aitop:receiver","kind":"collector","at":"2026-08-26T11:20:00Z","count":2},{"source":"aitop:receiver","capability":"identity","kind":"schema","at":"2026-08-26T11:20:00Z","count":1},{"source":"aitop:store:normal","capability":"state","kind":"sequence","at":"2026-08-26T11:20:00Z","count":3}]}}
